,title,release_year,genres,description,channels
70,Phantom Boy,2015,"['Fantasy', 'Adventure', 'Comedy', 'Animated']","In New York, a courageous detective named Alex is injured by a gangster who calls himself the Man With the Broken Face. Stuck in a hospital, Alex meets Leo, a bedridden 11-year-old who has the ability to leave his body and float around as an apparition. Like a ghost, invisible to all, he flies away and passes through walls. When the disfigured criminal threatens to attack the city's infrastructure, Leo springs into action to help the lawman foil his evil plan.",['620']
71,A media luz,1947,['Drama'],Un cantante de tango se enreda con varias mujeres; los problemas surgen cuando una queda embarazada y otra muere.,['979']
72,Funny Farm,1988,['Comedy'],"Former sportswriter Andy Farmer (Chevy Chase) and his secretly aspiring author wife, Elizabeth (Madolyn Smith), move to a small farm in Vermont so Andy can focus on writing a novel. They quickly realize that the locals are not as welcoming as they'd like and that the farm is more distracting than inspiring. Having trouble with his manuscript, and with his marriage on the rocks, Andy is forced to take hilariously drastic measures in an attempt to get his life back on track.",['521']
73,Mac,1992,['Drama'],"Mac (John Turturro) has always wanted to start his own construction business. But it's only after he and his two brothers, Vico (Michael Badalucco) and Bruno (Carl Capotorto), quit working for a bad boss (Olek Krupa) that he plunges in. The memory of his hardworking, recently deceased dad (Joe Paparone) also resonates strongly with Mac. He wants to build houses, but he wants to do it the right way, just like his pop. His ideals, though, threaten to destroy his relationship with his brothers.",['585']
74,Shaft,2019,"['Action', 'Comedy']","John Shaft Jr. may be an FBI cyber security expert, but to uncover the truth behind his best friend's untimely death, he needs an education that only his dad can provide. Absent throughout his childhood, the legendary John Shaft agrees to help his son navigate the heroin-infested underbelly of Harlem, N.Y. Besides, the locked and loaded Shaft has his own score to settle -- both professional and personal.",['540']
75,The Best Exotic Marigold Hotel,2011,['Comedy drama'],"Un grupo de ancianos ingleses decide disfrutar de su jubilación en Bangalore, una exótica población de la India, pero las diferencias culturales se pondrán de manifiesto y les crearán todo tipo de problemas.",['517']
76,The Best Exotic Marigold Hotel,2011,['Comedy drama'],"Some British retirees (Judi Dench, Maggie Smith, Bill Nighy) decide to outsource their retirement to exotic -- and less expensive -- India. Lured by advertisements for the newly restored Marigold Hotel and imagining a life of leisure in lush surroundings, they arrive and find that the Marigold is actually a shell of its former self. Though their new home is not quite what they had imagined, the retirees find that life and love can begin again when they let go of their pasts.",['511']
77,Mi caballo el Cantador,1979,['Drama'],Un cura se disfraza de ranchero para atrapar a los bandidos que amenazan con lastimar a su familia y sus propiedades.,['980']
78,The Star Packer,1934,['Western'],"Loner U.S. Marshal John Travers (John Wayne) foils the hold-up of a stagecoach, rescuing young woman Anita Matlock (Verna Hillie) from the clutches of the crooks and helping her back to town. But there, the sheriff is gunned down by bandits, so Travers starts investigating and connects the murder to a gang, led by an unidentified bandit known as the Shadow, who's been running the town ragged for some time. Travers then makes it his mission to restore order to the town and bring down the Shadow.",['607']
79,The Animal,2001,['Comedy'],"Marvin (Rob Schneider) is a man who doesn't have what it takes to fulfill his lifelong dream to be a cop. But his luck changes when he's critically injured in a car accident and a deranged scientist secretly uses animal organs to rebuild him. Energized by his new parts, Marvin leaves his weakness behind and achieves instant fame as a supercop. Now a hero, life is going great for Marvin until his animal instincts start taking over his body at all the wrong times.",['605']
80,Jeepers Creepers 2,2003,"['Horror', 'Thriller']","After his son is set upon by a scarecrow that seems to have come alive, farmer Jack Taggart Sr. (Ray Wise) and his son, Jack Taggart Jr. (Luke Edwards), go looking for an explanation. Meanwhile, a bus carrying high-school students breaks down nearby, and a creature known as the Creeper (Jonathan Breck) starts a killing spree. The elder Taggart soon realizes that the killings and the attack on his son are connected, and, after alerting the community to be on guard, he aims to pummel the Creeper.",['520']
81,'71,2014,"['Action', 'Thriller']",A young British soldier (Jack O'Connell) must find his way back to safety after his unit accidentally abandons him during a riot in the streets of Belfast.,['597']
82,Besos de azúcar,2013,['Drama'],"Nacho es un niño que intenta sobrevivir los primeros años de su adolescencia refugiado bailando en una máquina. Su vida cambia drásticamente cuando conoce a Mayra, la hija de una poderosa y temible mujer que lidera a los vendedores callejeros.",['982']
83,Alpha and Omega: Journey to Bear Kingdom,2017,"['Adventure', 'Animated', 'Children']","Stinky, Runt and Claudette spring into action when rogue wolves threaten the royal bears. With courage, wits and help from their wild friends, the alpha and omega wolves rise to protect the queen and princess and save their forest home.",['514']
84,Jiminy Glick in Lalawood,2004,['Comedy'],"A celebrity interviewer (Martin Short) and his wife (Jan Hooks) become tangled in a murder mystery involving a boozy actress, her family and her publicist.",['537']
85,Los días de la ballena,2019,['Drama'],"La historia de Cristina y Simón, dos jóvenes grafiteros y muralistas de Medellín, de espirítu salvaje, que desafían la violencia de la ciudad.",['524']
86,De-Lovely,2004,"['Musical', 'Biography', 'Drama']","At the staging of a musical production based on his life story, songwriter Cole Porter (Kevin Kline) begins to reflect on his life and career. As he trades notes with the play's director, Gabe (Jonathan Pryce), Porter recollects his meteoric rise on Broadway during the mid-1920s and his first meeting with wife and muse Linda Thomas (Ashley Judd). He also recalls his many extramarital, homosexual dalliances, and the deep depression and seclusion of his final years.",['595']
87,Vacancy,2007,['Thriller'],"When David (Luke Wilson) and Amy's (Kate Beckinsale) car breaks down, they have little choice but to spend the night at a remote hotel. The couple entertain themselves by watching low-budget slasher movies on TV -- until they realize that the horrifying images they see were recorded in the room in which they are staying. With hidden cameras capturing their every move, David and Amy must find a way out before they become the latest stars in another film in the series of snuff films.",['581']
88,Smart People,2008,"['Romantic comedy', 'Drama']","Acerbic, selfish and widowed, literature professor Lawrence Wetherhold (Dennis Quaid) is estranged from his son and his overachieving teenage daughter. Just as he begins a relationship with a former student (Sarah Jessica Parker), Lawrence's ne'er-do-well adoptive brother (Thomas Haden Church) lands on his doorstep. Lawrence realizes he must make some changes in his life and reconnect with his children in order to get on with his life.",['582']
89,Problem Child,1990,['Comedy'],"Ben (John Ritter) is a good-hearted guy who's always wanted a son of his own, but so far he and his wife have had no success. The couple adopt Junior (Michael Oliver), a redheaded hellion who quickly makes their lives miserable. Disaster follows Junior wherever he goes, from camping trips that require emergency-room visits to birthday parties that turn into Grand Guignol affairs. When Ben's incensed family tells him to get rid of the boy, he starts to wonder if they might be right.",['553']
90,Forsaken,2015,"['Western', 'Drama']","In 1872 Wyoming, a former gunslinger (Kiefer Sutherland) and his estranged father (Donald Sutherland) encounter a ruthless businessman (Brian Cox) and his gang of thugs.",['572']
91,Barely Lethal,2015,"['Action', 'Comedy']","Seeking a normal adolescence, a special-operations agent (Hailee Steinfeld) fakes her own death and enrolls in high school as an exchange student.",['571']
92,Born Free: A New Adventure,1996,['Drama'],"Two American teens (Jonathan Brandis, Ariana Richards) in Africa try to teach a lion cub one raised to survive in the wild.",['584']
93,The Whole Ten Yards,2004,['Comedy'],"After faking his death, former killer-for-hire Jimmy ""The Tulip"" Tudeski (Bruce Willis) retires to Mexico with his new wife, Jill (Amanda Peet), while his ex-wife, Cynthia (Natasha Henstridge), settles down in California with Nicholas ""Oz"" Oseransky (Matthew Perry), Jimmy's old neighbor. The peaceful lives of both couples are interrupted, however, when Gogolak (Kevin Pollak), a member of the Hungarian Mafia and a former associate of Jimmy's, seeks revenge by kidnapping Cynthia.",['519']
94,Maria Full of Grace,2004,['Drama'],"Seventeen-year-old Colombian Maria (Catalina Sandino Moreno) is desperate: pregnant and with a large family to care for, she's forced to leave a demanding job after an altercation with her boss. Needing work as soon as possible, she encounters charming Franklin (John Álex Toro), who offers her a dangerous job as a drug mule. With cocaine pellets in her stomach, Maria flies to New York for the drug drop-off, but finds her new line of work may be far riskier than it initially seemed.",['518']
95,The Hanoi Hilton,1987,['Drama'],"U.S. prisoners of war (Michael Moriarty, Jeffrey Jones, Paul Le Mat) suffer torture and propaganda at an infamous prison in North Vietnam.",['599']
96,Open Season,2006,"['Comedy', 'Adventure', 'Animated', 'Children']","Boog (Martin Lawrence), a 900-pound grizzly bear, is content entertaining tourists and living in park ranger Beth's (Debra Messing) barn. His life takes a drastic turn when he rescues a one-horned mule deer named Elliot (Ashton Kutcher) from a hunter (Gary Sinise), and is subsequently tranquilized and returned to the wild. Elliot and Boog recruit the other animals, notably a Scottish squirrel (Billy Connolly) and a beaver foreman, to help turn the tables on the hunters to make the woods safe.",['608']
97,Slaughterhouse Rulez,2018,"['Comedy', 'Horror']",A British boarding school turns into a battleground when unspeakable horrors emerge from the ground.,['602']
98,XY Chelsea,2019,"['Documentary', 'Biography']",Whistleblower Chelsea Manning leaks information about the wars in Iraq and Afghanistan.,['557']
99,Shazam!,2019,"['Action', 'Adventure', 'Comedy', 'Fantasy']","We all have a superhero inside of us -- it just takes a bit of magic to bring it out. In 14-year-old Billy Batson's case, all he needs to do is shout out one word to transform into the adult superhero Shazam. Still a kid at heart, Shazam revels in the new version of himself by doing what any other teen would do -- have fun while testing out his newfound powers. But he'll need to master them quickly before the evil Dr. Thaddeus Sivana can get his hands on Shazam's magical abilities.",['512']
100,After Darkness,2018,"['Drama', 'Science fiction']","As the sun burns out and darkness shrouds the planet, a family must reckon with long-held grudges and heal painful memories from the past.",['598']
101,Firestorm,1998,['Action'],A firefighter (Howie Long) and his mentor (Scott Glenn) encounter an escaped convict (William Forsythe) and his cohorts in a blazing forest.,['603']
102,Halwa,2018,['Drama'],"A woman rekindles her relationship with a childhood sweetheart through Facebook messages, but her abusive husband takes notice.",['516']
103,The Bounce Back,2016,['Romantic comedy'],"Relationship expert Matthew Taylor (Shemar Moore) is on a book tour promoting his bestseller ""The Bounce Back"" when he meets talk show circuit therapist Kristin Peralta (Nadine Velazquez), who calls him out as a fraud. Matthew's life is upended when, in spite of himself, he falls in love with this quick-witted woman and is forced to face painful truths about a past relationship.",['583']
104,My Super Ex-Girlfriend,2006,['Romantic comedy'],"A young man (Luke Wilson) discovers that the beautiful but manipulative woman (Uma Thurman) he is dating is really a superheroine known as G-Girl. After breaking up with her, he learns that ""hell hath no fury like a woman scorned"" as she unleashes her considerable powers against him.",['542']
105,Darkness,2002,['Horror'],"Paul (Stephan Enquist) and his older sister, Regina (Anna Paquin), unpack and settle into their new country home with their mother (Lena Olin) and father (Iain Glen). An atmosphere of dread slowly becomes evident in the house, and, before long, strange things are happening within its walls. As the supernatural occurrences get more intense and threatening, Regina looks into the house's dark history and struggles to uncover the reason behind the macabre presence.",['541']
106,Garden of Evil,1954,['Adventure'],"Traveling through Mexico, three American gunslingers -- Hooker (Gary Cooper), Fiske (Richard Widmark) and Daly (Cameron Mitchell) -- are approached by the beautiful Leah Fuller (Susan Hayward). She hires the trio to venture into dangerous territory and bring back her husband, John (Hugh Marlowe), who is trapped inside a remote gold mine. While the rewards could be considerable, so are the obstacles that they face to complete their hazardous assignment.",['607']
107,Red Dawn,1984,"['Action', 'Adventure']","In an alternate 1980s, the United States stands alone as communism grows stronger. When Soviet soldiers invade a small Colorado town, brothers Jed (Patrick Swayze) and Matt Eckert (Charlie Sheen) escape with friends to the forest. With their father, Tom (Harry Dean Stanton), a prisoner of the invading army, the children decide to fight against the Soviets. As the country comes under increasing attack, the group teams up with Lt. Col. Andrew Tanner (Powers Boothe) to take back their town.",['538']
108,Anna to the Infinite Power,1983,['Science fiction'],A child prodigy (Martha Byrne) learns she is part of a secret experiment in genetic engineering.,['539']
109,Miss Congeniality 2: Armed and Fabulous,2005,['Comedy'],"Gracie Hart (Sandra Bullock) was never thrilled to have to go undercover as a competitor in a beauty pageant. Now Gracie, who works for the FBI, is dealing with some very public attention thanks to her waltz down the runway. Her overnight celebrity does not impress her new partner, Sam Fuller (Regina King). But the pair has to put aside their differences when one of Gracie's former beauty queen pals, Cheryl Frasier (Heather Burns), turns up missing, and the FBI is put on the case.",['062']
110,Miss Congeniality 2: Armed and Fabulous,2005,['Comedy'],"Gracie Hart (Sandra Bullock) was never thrilled to have to go undercover as a competitor in a beauty pageant. Now Gracie, who works for the FBI, is dealing with some very public attention thanks to her waltz down the runway. Her overnight celebrity does not impress her new partner, Sam Fuller (Regina King). But the pair has to put aside their differences when one of Gracie's former beauty queen pals, Cheryl Frasier (Heather Burns), turns up missing, and the FBI is put on the case.",['167']
111,Love and Death,1975,['Comedy'],"In Woody Allen's comic take on 19th-century Russian philosophical novels and the Soviet-era epic films made from them, Boris (Woody Allen) is a simple Russian villager who pines from afar for his beautiful cousin Sonja (Diane Keaton). Forced against his will into joining the Russian army during the Napoleonic Wars, the cowardly Boris accidentally becomes a military hero. But when his beloved Sonja comes to him with a dangerous patriotic scheme, Boris debates his desires and beliefs.",['532']
112,Last Christmas,2019,"['Romantic comedy', 'Holiday']","Nothing seems to go right for young Kate, a frustrated Londoner who works as an elf in a year-round Christmas shop. But things soon take a turn for the better when she meets Tom -- a handsome charmer who seems too good to be true. As the city transforms into the most wonderful time of the year, Tom and Kate's growing attraction turns into the best gift of all -- a Yuletide romance.",['513']
113,Blood and Sand,1941,['Drama'],"Brash young Spanish peasant Juan Gallardo (Tyrone Power) aspires to follow his dead father's footsteps into the bullring, despite his mother's fears. Bidding his childhood sweetheart Carmen (Linda Darnell) farewell, Juan and his friends travel to Madrid to learn the bullfighting craft. Years later, when Juan's fame as a matador soars, he returns to Seville to marry Carmen. Soon, Juan's head is turned by the elegant temptress Doña Sol De Muira (Rita Hayworth), and his career takes a turn.",['083']
114,Blood and Sand,1941,['Drama'],"Brash young Spanish peasant Juan Gallardo (Tyrone Power) aspires to follow his dead father's footsteps into the bullring, despite his mother's fears. Bidding his childhood sweetheart Carmen (Linda Darnell) farewell, Juan and his friends travel to Madrid to learn the bullfighting craft. Years later, when Juan's fame as a matador soars, he returns to Seville to marry Carmen. Soon, Juan's head is turned by the elegant temptress Doña Sol De Muira (Rita Hayworth), and his career takes a turn.",['632']
115,Project X,1987,['Comedy drama'],"As punishment for a minor offense, the Air Force assigns pilot Jimmy Garrett (Matthew Broderick) to watch over a group of chimpanzees used for military experiments. Jimmy bonds with Virgil, a chimp capable of communicating with sign language. But when he witnesses the military's plan to kill the animals with radiation, Jimmy enlists the help of Teri MacDonald (Helen Hunt), the graduate student responsible for teaching sign language to Virgil, to free the chimps.",['533']
116,The Perfect Bride,1991,['Thriller'],A bridegroom's (Linden Ashby) sister (Kelly Preston) sees something sinister in the unsullied nurse (Sammi Davis) about to become her in-law.,['076']
117,The Perfect Bride,1991,['Thriller'],A bridegroom's (Linden Ashby) sister (Kelly Preston) sees something sinister in the unsullied nurse (Sammi Davis) about to become her in-law.,['630']
118,Quiero mariachis,2020,['Action'],"A pesar de la vida excesiva que ha llevado Sebastián, se enamora de Rosita. Los padres de ella quieren casarla con Julián, el heredero de la familia más adinerada de la región.",['972']
119,Birth Rite,2003,['Horror'],"A woman meets a mysterious man who has magical powers and shows her how her parents were murdered. As she delves further into the black arts of witchcraft, her adopted sister fights to save her soul from the evil that possesses her.",['1849']
120,Loosies,2011,['Comedy drama'],A onetime lover (Jaimie Alexander) confronts a pickpocket (Peter Facinelli) and tells him that she is pregnant with his child.,['623']
121,La isla de los dinosaurios,1966,['Fantasy'],Un profesor cree que la Atlántida existe y va a buscarla con tres de sus alumnos y un grupo de científicos.,['890']
122,RV,2006,"['Comedy', 'Children']","Los Munro son una típica familia disfuncional estadounidense, que se completa con unos padres rebeldes, incomunicativos y desconcertados. El patriarca Bob quisiera remediar la situación antes de que su hijo e hija los excluyan de sus vidas. Bob renta una casa rodante para llevar de vacaciones a su familia y descubre que estar juntos puede resultar muy peligroso.",['973']
123,La española inglesa,2015,"['Historical drama', 'Drama']","Basada en una de las Novelas ejemplares de Miguel de Cervantes. La española inglesa es una joven raptada en su tierna infancia durante el saqueo de Cádiz por las tropas inglesas. Llevada a Londres, es criada como una hija por la familia de su secuestrador y se enamorará de su noble hijo.",['984']
124,Lobo,2010,['Drama'],"La historia de un escritor quien, tras el violento asesinato su familia, se muda a la ciudad de Zacatecas para tratar de reconstruir su vida.",['983']
125,Mi mujer no es mía,1951,['Drama'],"Un joven parrandero le dice a su tía que es un hombre casado, sólo para que ella no lo obligue a desposar a su prima.",['985']
126,Cosmo Jones: Crime Smasher,1943,['Mystery'],A detective who learned the ropes through a correspondence course puts his training to use on a mob-related killing.,['1248']
127,Se solicita asesino con referencias,1991,['Adventure'],"Dos policías se enfrentan a unos criminales, pero uno de ellos sale herido. El doctor, al hacerle los exámenes, detecta una rara enfermedad mortal. Muy desilusionado porque su seguro solo cubre su sepelio, el policía decide hacer algo ilegal.",['842']
128,Ski School,1991,['Comedy'],"Dave Marshak (Dean Cameron) and his friends are a pack of highly skilled skiers and devoted party animals. On the slopes, they are known as ""Section 8."" But their reputation is at risk when a ski school of snobs -- headed by pompous and preppy Reid Janssens (Mark Thomas Miller) -- shows up looking to win the end-of-season downhill competition. Now, the stakes have never been higher because, if Section 8 is beaten, they'll lose more than bragging rights. They'll also lose their jobs.",['522']
129,Red Tails,2012,"['Historical drama', 'War']","During World War II, the Civil Aeronautics Authority selects 13 black cadets to become part of an experimental program at the Tuskegee Institute in Alabama. The program aims at training ""colored personnel"" to become fighter pilots for the Army. However, discrimination, lack of institutional support and the racist belief that these men lacked the intelligence and aptitude for the job dog their every step. Despite this, the Tuskegee Airmen, as they become known, more than prove their worth.",['516']
130,Bless the Child,2000,['Thriller'],"When Maggie's sister Jenna saddles her with an autistic newborn named Cody she touches Maggie's heart and becomes the daughter she has always longed for. But six years later Jenna suddenly re-enters her life and, with her mysterious new husband, Eric Stark, abducts Cody. Despite the fact that Maggie has no legal rights to Cody, FBI agent John Travis, takes up her cause when he realizes that Cody shares the same birth date as several other recently missing children.",['534']
131,White Boy,2017,"['Documentary', 'Crime drama']","In 1980s Detroit, a 17-year-old runs a sophisticated drug operation. Thirty years later, journalists, police and federal agents discuss him for the first time.",['606']
132,Flaming Star,1960,['Western'],"In this Western set on the Texas frontier, Pacer Burton (Elvis Presley) is the mixed-race son of a white rancher (John McIntire) and his second wife, Kiowa woman Neddy (Dolores del Río). When some local racists cause Neddy's death by preventing the doctor from coming to her aid, a war between the whites and the tribe erupts. As the war threatens to drive a wedge between Pacer and his white brother, Clint (Steve Forrest), he takes matters into his own hands.",['622']
133,55 Steps,2017,"['Biography', 'Drama']",A workaholic lawyer helps a psychiatric patient sue a hospital for mistreating its patients.,['621']
134,Double Trouble,1967,['Musical comedy'],An American singer (Elvis Presley) in Europe gets mixed up with jewel thieves and a runaway English heiress (Annette Day).,['064']
135,Double Trouble,1967,['Musical comedy'],An American singer (Elvis Presley) in Europe gets mixed up with jewel thieves and a runaway English heiress (Annette Day).,['631']
136,Ready to Rumble,2000,['Comedy'],"Gordie Boggs (David Arquette) and Sean Dawkins (Scott Caan) are best friends who operate a sewage truck and idolize pro wrestler Jimmy King (Oliver Platt). After Diamond Dallas Page (Diamond Dallas Page) dethrones their hero, Gordie and Sean embark on a mission to help King get his title back. When they finally track him down, however, they discover that King is not too keen on recapturing his former glory. Can the boys find a way to motivate the faded champ?",['620']
137,The SpongeBob SquarePants Movie,2004,"['Comedy', 'Adventure', 'Animated', 'Children']","In this lively animated adventure, undersea oddball SpongeBob SquarePants and his starfish friend, Patrick, embark on a quest to clear the name of Mr. Krabs, the owner of the Krusty Krab restaurant, who has been framed for stealing the crown of ocean deity King Neptune. Leaving the familiar confines of Bikini Bottom, SpongeBob and Patrick venture out towards Shell City, where they hope to find Neptune's crown, but numerous obstacles stand (or float) in their way.",['558']
138,"Girl, Interrupted",1999,['Drama'],"Set in the changing world of the late 1960s, ""Girl, Interrupted"" is the searing true story of Susanna Kaysen (Winona Ryder), a young woman who finds herself at a renowned mental institution for troubled young women, where she must choose between the world of people who belong on the inside -- like the seductive and dangerous Lisa (Angelina Jolie) -- or the often difficult world of reality on the outside.",['604']
139,Just My Luck,2006,['Romantic comedy'],"As the luckiest woman in the world, Ashley (Lindsay Lohan) has a wonderful life, which all changes after she kisses a stranger (Chris Pine) at a costume party. She sees everything turn into a living hell, as she realizes that she has unwittingly exchanged her good fortune for the stranger's bad luck.",['515']
140,Almost Heroes,1998,['Comedy'],"Un explorador engreído y un rastreador borracho intentan alcanzar el océano Pacífico en 1804 antes de que lo logren sus competidores, Lewis y Clark.",['536']
